{"schema_version":"1.0.0","circuit":{"slug":"las-vegas","name":"拉斯维加斯街道赛道","season":2026},"coordinate_system":{"type":"telemetry_cartesian","units":"decimeters","transform":{"method":"svg_track_arclength_normal_warp","fit_rms_m":0.0,"prewarp_similarity_rms_m":15.39,"scale":22.70806775,"rotation_deg":1.59358,"translation":[-9416.377,14628.65],"mirrored":true,"track_source_id":"official-map-annotation","target_source_id":"openf1"}},"sources":[{"id":"osm","kind":"geometry","label":"OpenStreetMap","url":"https://www.openstreetmap.org/copyright","license":"ODbL-1.0","retrieved_at":"2026-08-16"},{"id":"bacinger","kind":"geometry","label":"bacinger/f1-circuits","url":"https://github.com/bacinger/f1-circuits","license":"MIT","retrieved_at":"2026-08-16"},{"id":"openf1","kind":"telemetry","label":"OpenF1 multi-driver location consensus","url":"https://openf1.org/","license":"CC-BY-NC-SA-4.0","retrieved_at":"2026-08-16"},{"id":"corner-anchor-bootstrap","kind":"other","label":"Migrated turn anchors pending independent map review","url":"urn:f1-seat:corner-anchor-bootstrap","license":null,"retrieved_at":"2026-08-16"},{"id":"geometry-estimate","kind":"other","label":"本地几何半径推导","url":"urn:f1-seat:geometry-estimate","license":null,"retrieved_at":"2026-08-16"},{"id":"official","kind":"official","label":"Las Vegas GP 2026 ticket overview","url":"https://www.f1lasvegasgp.com/2026/","license":null,"retrieved_at":"2026-08-16"},{"id":"official-main","kind":"official","label":"Heineken Silver Main Grandstand","url":"https://www.f1lasvegasgp.com/tickets/grandstands/main-grandstand/","license":null,"retrieved_at":"2026-08-16"},{"id":"official-tmobile","kind":"official","label":"T-Mobile Grandstands","url":"https://www.f1lasvegasgp.com/tickets/grandstands/t-mobile-grandstands/","license":null,"retrieved_at":"2026-08-16"},{"id":"official-t3","kind":"official","label":"Turn 3 Grandstand","url":"https://www.f1lasvegasgp.com/tickets/grandstands/turn-3-grandstand/","license":null,"retrieved_at":"2026-08-16"},{"id":"official-heineken","kind":"official","label":"Heineken Grandstands","url":"https://www.f1lasvegasgp.com/tickets/grandstands/heineken-grandstands/","license":null,"retrieved_at":"2026-08-16"},{"id":"official-hamilton","kind":"official","label":"Lewis Hamilton Grandstand Package","url":"https://www.f1lasvegasgp.com/tickets/grandstands/west-harmon-grandstands/","license":null,"retrieved_at":"2026-08-16"},{"id":"user-map-overlay","kind":"geometry","label":"人工叠图配准：lasvegas.png","url":"urn:f1-seat:local-map:las-vegas-legacy-schematic-map","license":null,"retrieved_at":"2026-07-24"},{"id":"official-map-annotation","kind":"geometry","label":"Official-map annotation (AI-assisted and manually reviewed)","url":"urn:f1-seat:official-map-annotation","license":null,"retrieved_at":"2026-08-18"}],"coverage":{"status":"partial","geometry_count":25,"base_geometry_count":25,"supplemental_map_count":0,"osm_geometry_count":0,"manual_geometry_count":25,"official_inventory_count":5,"official_inventory_geometry_count":5,"named_count":5,"roof_verified_count":0,"view_method":"radius_estimate"},"grandstands":[{"id":"svg-las-vegas-001","name":"Heineken Silver Main Grandstand","aliases":[],"geometry":{"type":"Polygon","coordinates":[[2732,-390],[2935,-572],[3780,374],[3578,556],[2732,-390]],"source_id":"official-map-annotation"},"position":{"center":[3256,-8],"track_s":1196.4,"distance_to_track_m":49},"view":{"corners":[{"number":1,"letter":null,"label":"1","distance_m":170},{"number":2,"letter":null,"label":"2","distance_m":198},{"number":3,"letter":null,"label":"3","distance_m":226}],"method":"radius_estimate","screen":"unknown","notes":[]},"features":{"roof":{"status":"unknown","note":"当前资料未核实"},"seating":"reserved","accessible":"unknown"},"provenance":{"geometry":["official-map-annotation"],"name":["official-main"],"view.corners":["geometry-estimate"],"features.seating":["official-main"]},"confidence":{"geometry":0.9,"name":1.0,"roof":0.0,"view":0.45},"validity":{"season_from":2026,"season_to":null,"last_verified":"2026-08-18"},"extensions":{"placement":"track_offset_rectangle","anchor":{"corner":"1","along_m":-162},"side":-1,"zone_type":"grandstand","svg_reference_label":null,"svg_element_ids":[],"svg_prewarp_similarity_rms_m":15.39}},{"id":"svg-las-vegas-023","name":"Hospitality 23","aliases":[],"view":{"corners":[{"number":3,"letter":null,"label":"3","distance_m":132},{"number":2,"letter":null,"label":"2","distance_m":137},{"number":1,"letter":null,"label":"1","distance_m":155}],"method":"radius_estimate","screen":"unknown","notes":[]},"features":{"roof":{"status":"unknown","note":"SVG 不包含顶棚核实信息"},"seating":"unknown","accessible":"unknown"},"provenance":{"geometry":["official-map-annotation"],"name":["official-map-annotation"],"view.corners":["geometry-estimate"]},"confidence":{"geometry":0.9,"name":0.35,"roof":0,"view":0.45},"validity":{"season_from":2026,"season_to":null,"last_verified":"2026-08-18"},"extensions":{"zone_type":"hospitality","svg_reference_label":null,"svg_element_ids":[],"svg_prewarp_similarity_rms_m":15.39},"geometry":{"type":"Polygon","coordinates":[[1979,253],[2182,71],[3030,1019],[2991,1272],[1979,253]],"source_id":"official-map-annotation"},"position":{"center":[2546,654],"track_s":1196.4,"distance_to_track_m":49}},{"id":"svg-las-vegas-024","name":"Grandstand 24","aliases":["SVG Grandstand 24"],"view":{"corners":[{"number":1,"letter":null,"label":"1","distance_m":186},{"number":2,"letter":null,"label":"2","distance_m":223},{"number":3,"letter":null,"label":"3","distance_m":257}],"method":"radius_estimate","screen":"unknown","notes":[]},"features":{"roof":{"status":"unknown","note":"SVG 不包含顶棚核实信息"},"seating":"unknown","accessible":"unknown"},"provenance":{"geometry":["official-map-annotation"],"name":["official-map-annotation"],"view.corners":["geometry-estimate"]},"confidence":{"geometry":0.9,"name":0.35,"roof":0,"view":0.45},"validity":{"season_from":2026,"season_to":null,"last_verified":"2026-08-18"},"extensions":{"zone_type":"grandstand","svg_reference_label":null,"svg_element_ids":[],"svg_prewarp_similarity_rms_m":15.39},"geometry":{"type":"Polygon","coordinates":[[3036,-514],[3239,-695],[3928,76],[3725,258],[3036,-514]],"source_id":"official-map-annotation"},"position":{"center":[3482,-219],"track_s":1196.4,"distance_to_track_m":79}},{"id":"svg-las-vegas-006","name":"Grandstand 6","aliases":["SVG Grandstand 6"],"view":{"corners":[{"number":2,"letter":null,"label":"2","distance_m":64},{"number":3,"letter":null,"label":"3","distance_m":146},{"number":1,"letter":null,"label":"1","distance_m":148}],"method":"radius_estimate","screen":"unknown","notes":[]},"features":{"roof":{"status":"unknown","note":"SVG 不包含顶棚核实信息"},"seating":"unknown","accessible":"unknown"},"provenance":{"geometry":["official-map-annotation"],"name":["official-map-annotation"],"view.corners":["geometry-estimate"]},"confidence":{"geometry":0.9,"name":0.35,"roof":0,"view":0.45},"validity":{"season_from":2026,"season_to":null,"last_verified":"2026-08-18"},"extensions":{"zone_type":"grandstand","svg_reference_label":null,"svg_element_ids":[],"svg_prewarp_similarity_rms_m":15.39},"geometry":{"type":"Polygon","coordinates":[[1913,2078],[2090,1871],[2893,2402],[2754,2637],[1913,2078]],"source_id":"official-map-annotation"},"position":{"center":[2412,2247],"track_s":4062.2,"distance_to_track_m":51}},{"id":"svg-las-vegas-005","name":"Grandstand 5","aliases":["SVG Grandstand 5"],"view":{"corners":[{"number":3,"letter":null,"label":"3","distance_m":65},{"number":4,"letter":null,"label":"4","distance_m":141},{"number":17,"letter":null,"label":"17","distance_m":220}],"method":"radius_estimate","screen":"unknown","notes":[]},"features":{"roof":{"status":"unknown","note":"SVG 不包含顶棚核实信息"},"seating":"unknown","accessible":"unknown"},"provenance":{"geometry":["official-map-annotation"],"name":["official-map-annotation"],"view.corners":["geometry-estimate"]},"confidence":{"geometry":0.9,"name":0.35,"roof":0,"view":0.45},"validity":{"season_from":2026,"season_to":null,"last_verified":"2026-08-18"},"extensions":{"zone_type":"grandstand","svg_reference_label":null,"svg_element_ids":[],"svg_prewarp_similarity_rms_m":15.39},"geometry":{"type":"Polygon","coordinates":[[729,811],[1029,408],[1280,582],[862,1038],[729,811]],"source_id":"official-map-annotation"},"position":{"center":[975,710],"track_s":5758.6,"distance_to_track_m":63}},{"id":"svg-las-vegas-007","name":"Grandstand 7","aliases":["SVG Grandstand 7"],"view":{"corners":[{"number":4,"letter":null,"label":"4","distance_m":76},{"number":3,"letter":null,"label":"3","distance_m":79},{"number":2,"letter":null,"label":"2","distance_m":162}],"method":"radius_estimate","screen":"unknown","notes":[]},"features":{"roof":{"status":"unknown","note":"SVG 不包含顶棚核实信息"},"seating":"unknown","accessible":"unknown"},"provenance":{"geometry":["official-map-annotation"],"name":["official-map-annotation"],"view.corners":["geometry-estimate"]},"confidence":{"geometry":0.9,"name":0.35,"roof":0,"view":0.45},"validity":{"season_from":2026,"season_to":null,"last_verified":"2026-08-18"},"extensions":{"zone_type":"grandstand","svg_reference_label":null,"svg_element_ids":[],"svg_prewarp_similarity_rms_m":15.39},"geometry":{"type":"Polygon","coordinates":[[963,2870],[1013,2288],[1017,2260],[1027,2205],[1043,2139],[1065,2079],[1106,1998],[1155,1939],[1217,1888],[1304,1844],[1400,1801],[1508,1764],[1586,1745],[1746,1713],[1830,1717],[1866,1729],[1903,1744],[1940,1761],[1234,2894],[963,2870]],"source_id":"official-map-annotation"},"position":{"center":[1364,2020],"track_s":6267.0,"distance_to_track_m":69}},{"id":"svg-las-vegas-008","name":"Turn 3 Grandstand","aliases":[],"geometry":{"type":"Polygon","coordinates":[[-183,2166],[-98,1318],[172,1355],[89,2183],[-183,2166]],"source_id":"official-map-annotation"},"position":{"center":[-5,1756],"track_s":6690.6,"distance_to_track_m":67},"view":{"corners":[{"number":4,"letter":null,"label":"4","distance_m":69},{"nu